{
  "$schema": "https://raw.githubusercontent.com/xGreeny/hardening-lens/v1.2.1/src/HardeningLens/Schema/result.schema.json",
  "schemaVersion": "1.1",
  "scan": {
    "id": "e747bf2b-e9de-4e5a-bffe-514e51b86fe8",
    "collectedAt": "2026-06-12T09:38:02.1200000Z",
    "moduleVersion": "1.2.1",
    "redacted": false,
    "readOnly": true,
    "elevated": true,
    "partialCollection": false,
    "exceptionRegisterUsed": true,
    "selectedControlCount": 54,
    "collectionDurationMs": 1298
  },
  "system": {
    "ComputerName": "SRV-DEMO-01",
    "Domain": "LAB.EXAMPLE.INVALID",
    "DomainJoined": true,
    "DetectedRole": "MemberServer",
    "ProductType": 3,
    "OSCaption": "Microsoft Windows Server 2025 Standard",
    "OSVersion": "10.0.26100",
    "BuildNumber": "26100",
    "OSArchitecture": "64-bit",
    "Manufacturer": "Demo Hypervisor",
    "Model": "Generation 2 Virtual Machine",
    "PowerShellVersion": "7.6.3",
    "PowerShellEdition": "Core",
    "CurrentUser": "LAB\\audit.runner",
    "IsElevated": true
  },
  "baseline": {
    "name": "MemberServer",
    "displayName": "Windows Member Server",
    "version": "1.1.0",
    "description": "Posture profile for domain-joined or centrally managed Windows member servers.",
    "source": "BuiltIn",
    "sourceBasis": [
      "Microsoft Security Compliance Toolkit and current Microsoft Windows security guidance",
      "Operational security telemetry and recoverability practices"
    ],
    "supportedRoles": [
      "MemberServer"
    ],
    "controlCount": 54,
    "notes": [
      "Application roles can require documented exceptions. The profile does not infer application-specific firewall, service, or authentication requirements."
    ]
  },
  "provenance": {
    "catalogVersion": "1.1.0",
    "catalogDigest": "96c64d2c508f3e0a6edfc6da41494808a243046a50c9e00de5499e9e185958f8",
    "baselineDigest": "14c95413f6e477b4a1e1fdebbbf9270a56df02567bd1b0c8a0572c5ccedf056e",
    "capabilities": [
      {
        "name": "AsrRules",
        "available": true,
        "detail": "Synthetic demo fixture"
      },
      {
        "name": "AuditPolicy",
        "available": true,
        "detail": "Synthetic demo fixture"
      },
      {
        "name": "AutoRun",
        "available": true,
        "detail": "Synthetic demo fixture"
      },
      {
        "name": "BitLocker",
        "available": true,
        "detail": "Synthetic demo fixture"
      },
      {
        "name": "CredentialGuard",
        "available": true,
        "detail": "Synthetic demo fixture"
      },
      {
        "name": "DefenderPreference",
        "available": true,
        "detail": "Synthetic demo fixture"
      },
      {
        "name": "DefenderSignatureAge",
        "available": true,
        "detail": "Synthetic demo fixture"
      },
      {
        "name": "DefenderStatus",
        "available": true,
        "detail": "Synthetic demo fixture"
      },
      {
        "name": "DeviceGuardService",
        "available": true,
        "detail": "Synthetic demo fixture"
      },
      {
        "name": "EventLog",
        "available": true,
        "detail": "Synthetic demo fixture"
      },
      {
        "name": "FirewallProfiles",
        "available": true,
        "detail": "Synthetic demo fixture"
      },
      {
        "name": "LapsAdEncryption",
        "available": true,
        "detail": "Synthetic demo fixture"
      },
      {
        "name": "LapsBackup",
        "available": true,
        "detail": "Synthetic demo fixture"
      },
      {
        "name": "LapsPasswordAge",
        "available": true,
        "detail": "Synthetic demo fixture"
      },
      {
        "name": "LocalGuestAccount",
        "available": true,
        "detail": "Synthetic demo fixture"
      },
      {
        "name": "PowerShellModuleLogging",
        "available": true,
        "detail": "Synthetic demo fixture"
      },
      {
        "name": "RegistryValue",
        "available": true,
        "detail": "Synthetic demo fixture"
      },
      {
        "name": "SecureBoot",
        "available": true,
        "detail": "Synthetic demo fixture"
      },
      {
        "name": "Service",
        "available": true,
        "detail": "Synthetic demo fixture"
      },
      {
        "name": "SmbClient",
        "available": true,
        "detail": "Synthetic demo fixture"
      },
      {
        "name": "SmbServer",
        "available": true,
        "detail": "Synthetic demo fixture"
      },
      {
        "name": "WindowsOptionalFeature",
        "available": true,
        "detail": "Synthetic demo fixture"
      },
      {
        "name": "WinRM",
        "available": true,
        "detail": "Synthetic demo fixture"
      }
    ],
    "exceptionDigest": "a6147cdc628a44eb56a5bf4fff58bbd0672c9947b33b512b421c14636318538a"
  },
  "summary": {
    "Total": 54,
    "Applicable": 54,
    "Pass": 42,
    "Fail": 6,
    "Warning": 3,
    "Excepted": 1,
    "Unknown": 1,
    "Error": 1,
    "NotApplicable": 0,
    "HardeningScore": 79.6,
    "EvidenceCoverage": 96.3,
    "HighestOpenSeverity": "High",
    "ScoringModel": "Severity-weighted pass percentage. Exceptions, unknowns, warnings, and errors receive no pass credit; not-applicable and informational controls are excluded."
  },
  "results": [
    {
      "controlId": "HL-ACC-001",
      "title": "Built-in Guest account is disabled",
      "category": "Identity",
      "severity": "High",
      "status": "Pass",
      "originalStatus": null,
      "expected": "Disabled",
      "actual": "Disabled",
      "message": "The effective state matches the selected baseline.",
      "evidence": {
        "Source": "Synthetic demo fixture",
        "Probe": "LocalGuestAccount",
        "Resolved": true
      },
      "rationale": "An enabled guest account provides an unnecessary logon path with weak accountability.",
      "remediation": "Disable the built-in Guest account through Group Policy, Intune, or local security policy and verify that no application depends on it.",
      "references": [
        "https://learn.microsoft.com/windows/security/operating-system-security/device-management/windows-security-configuration-framework/windows-security-baselines"
      ],
      "tags": [
        "account",
        "local-security"
      ],
      "probe": "LocalGuestAccount",
      "exception": null,
      "collectedAt": "2026-06-12T09:38:02.1200000Z",
      "probeDurationMs": 1
    },
    {
      "controlId": "HL-UAC-001",
      "title": "User Account Control is enabled",
      "category": "Privilege Management",
      "severity": "Critical",
      "status": "Pass",
      "originalStatus": null,
      "expected": 1,
      "actual": 1,
      "message": "The effective state matches the selected baseline.",
      "evidence": {
        "Source": "Synthetic demo fixture",
        "Probe": "RegistryValue",
        "Resolved": true,
        "Path": "HKLM:\\SOFTWARE\\Microsoft\\Windows\\CurrentVersion\\Policies\\System",
        "Name": "EnableLUA",
        "Value": 1
      },
      "rationale": "Disabling UAC removes an important privilege boundary and weakens multiple Windows security features.",
      "remediation": "Set \"User Account Control: Run all administrators in Admin Approval Mode\" to Enabled and restart the device.",
      "references": [
        "https://learn.microsoft.com/windows/security/application-security/application-control/user-account-control/settings-and-configuration"
      ],
      "tags": [
        "uac",
        "privilege"
      ],
      "probe": "RegistryValue",
      "exception": null,
      "collectedAt": "2026-06-12T09:38:02.1200000Z",
      "probeDurationMs": 2
    },
    {
      "controlId": "HL-UAC-002",
      "title": "Administrator elevation prompts require consent",
      "category": "Privilege Management",
      "severity": "High",
      "status": "Pass",
      "originalStatus": null,
      "expected": [
        1,
        2,
        3,
        4,
        5
      ],
      "actual": [
        1,
        2,
        3,
        4,
        5
      ],
      "message": "The effective state matches the selected baseline.",
      "evidence": {
        "Source": "Synthetic demo fixture",
        "Probe": "RegistryValue",
        "Resolved": true,
        "Path": "HKLM:\\SOFTWARE\\Microsoft\\Windows\\CurrentVersion\\Policies\\System",
        "Name": "ConsentPromptBehaviorAdmin",
        "Value": [
          1,
          2,
          3,
          4,
          5
        ]
      },
      "rationale": "Silent elevation makes malicious or accidental privileged execution harder to detect and contain.",
      "remediation": "Configure the administrator elevation prompt to \"Prompt for consent for non-Windows binaries\" or a stricter credential prompt.",
      "references": [
        "https://learn.microsoft.com/windows/security/application-security/application-control/user-account-control/settings-and-configuration"
      ],
      "tags": [
        "uac",
        "privilege"
      ],
      "probe": "RegistryValue",
      "exception": null,
      "collectedAt": "2026-06-12T09:38:02.1200000Z",
      "probeDurationMs": 3
    },
    {
      "controlId": "HL-UAC-003",
      "title": "Built-in Administrator uses Admin Approval Mode",
      "category": "Privilege Management",
      "severity": "Medium",
      "status": "Fail",
      "originalStatus": null,
      "expected": 1,
      "actual": 0,
      "message": "The built-in Administrator account is not running in Admin Approval Mode.",
      "evidence": {
        "Path": "HKLM:\\SOFTWARE\\Microsoft\\Windows\\CurrentVersion\\Policies\\System",
        "Name": "FilterAdministratorToken",
        "Value": 0,
        "Kind": "DWord"
      },
      "rationale": "The built-in Administrator otherwise runs with a full token without UAC consent.",
      "remediation": "Set \"User Account Control: Admin Approval Mode for the Built-in Administrator account\" to Enabled.",
      "references": [